SR NO,Type,Keywords,Favored Careers,Disfavoured Careers
13,RLUEI ,"avoidant, withdrawn, not usually happy, does not believe in human goodness, loner, moody, avoids crowds, depressed, overwhelmed by unpleasant feelings frequently, agnostic/atheistic tendencies, unsure where life is going, impatient, avoids eye contact, does not think things work out for the best, discontent, negative, suspicious of others, uncooperative, socially uncomfortable, hard to get to know, not punctual, low self confidence, pessimistic, lonely, does not finish work on time, does not like to lead, attracted to things associated with sadness, ambivalent about the problems of others, feels defective, fears failure, often bored, ambivalent about the suffering of others, unproductive, avoids unnecessary interaction, easily frustrated, does not finish many things, lower energy level, focuses on fantasies instead of reality, ambivalent about the needs of others, easily annoyed, rarely prepared, disorganized, quiet around strangers, slow to forgive, hard to understand, not that interested in others, skeptical, wounded at the core, self absorbed","
philosopher, freelance writer, novelist, author, astronomer, book editor, freelance artist, scholar, bookstore owner, bookseller, screenwriter, philosophy professor, poet, cinematographer, artist, playwright, librarian, comic book artist, art historian, publisher, archeologist, scientist, composer, video game designer, egyptologist, museum curator, researcher, paleontologist, anthropologist, musician, genetics researcher, historian, theologian, research psychologist, art director, research scientist, songwriter, history professor, linguist, computer animator, professor of english, illustrator, painter, assassin, cartoonist, library assistant, travel writer, curator, film critic, environmental scientist, filmmaker, journalist, english professor, aerospace engineer, political scientist, computer scientist, art curator, audio engineer, archivist, art education, college professor, academic, technical writer, webmaster, animator, psychoanalyst, music journalist, geneticist, astronaut, research assistant, software developer, website designer, movie director, web developer, film editor, copywriter, digital artist, editor music therapist, geologist, web designer, biologist, biochemist, mercenary","supervisor, sports management, event planner, wedding planner, even coordinator, manager, business administrator, administrator, businessman, childcare worker, hospitality manager, hospitality worker, coach, office manager, sales associate, business manager, athletic trainer, kindergarten teacher, preschool teacher, office administrator, human resources manager, health care worker, public relations manager, personal assistant, customer service representative, customer service employee, administrative support, business owner, early childhood educator, social services worker, office worker, secretary, fundraiser, receptionist, sales manager, nurse practitioner, pediatric nurse, executive, executive assistant"
14,RLUEN ,"overwhelmed by unpleasant feelings frequently, feels unattractive to others, lonely, not well read, socially unskilled, easily confused, discontent, attracted to things associated with sadness, socially uncomfortable, avoidant, depressed, pessimistic, feels defective, withdrawn, feels ordinary, easily offended, lower energy level, impatient, not usually happy, not well informed, does not believe in human goodness, self loathing, does not admit mistakes, not open to new experiences, moody, not known for generosity, feels victimized, selfish, loner, unambitious, unadventurous, inflexible, easily discouraged, insensitive to the needs of others, not that interested in others, dislikes crowds, driven by own personal gain, unassertive, tense, fearful, unimaginative, not that interested in relationships, uncooperative, feels incapable, dependent, doubting, not good at sports, weak sense of purpose, feels untalented, can be aggressive when hurt, easily moved to tears, quiet around strangers, acts without thinking, relates to broken and discarded things, slow to acquire skill","cartoonist, illustrator, digital artist, personal assistant, body piercer, song writer, video game designer, computer animator, singer, web designer, art director, work in the fashion industry, graphic artist, bounty hunter, job in professional athletics, library assistant, musician, job in the arts and media industry, software designer, truck driver, video editor, mortician, tattoo artist, pastry chef, music producer, freelance artist, plumber, funeral director, webmaster, bookseller, hair stylist, camera operator, veterinary technician, costume designer, graphic designer","academic, project manager, college professor, manager, public relations specialist, instructor, supervisor, educator, administator, research scientist, management consultant, ambassador, international relations specialist, strategist, business administrator, researcher, scholar, executive"
15,RCUEN,"not easily hurt, does not need things to add up perfectly, keeps emotions under control, spends more time in solitary activities than group activities, when ending an association - tends to stop all communication without explanation, does not readily admit mistakes, underachiever, not known for generosity, level emotions, does not care what people think, does not fit in, more logical than abstract, does not value tradition, uninterested in leadership, not impressionable, not prone to envy, values money over acceptance, not open about feelings, unproductive, values solitude, not very happy, pessimistic, plain appearance, inflexible, won't do much to avoid rejection, not afraid of doing the wrong thing, underachiever, does not accept people as they are, unable to stand up for self, slow to forgive, not that interested in others, does not care about image, not prone to giving compliments, rarely prepared, quiet around strangers, does not like touchy feely people, avoids responsibilities, avoids difficult reading material, rarely reinvents self, does not like to lead, not prone to worrying","assassin, game or video game designer, race car driver, mechanic, sound engineer, construction worker, automotive technician, electrician, musician, job in professional athletics, video editor, software designer, comic book artist, fighter pilot, animator, bounty hunter, cartoonist, software developer, mechanic, soldier, computer programmer, webmaster, electrical engineer, graphic artist, engineer, career in the computer industry, record store owner, truck driver, industrial engineer, carpenter, disc jockey, career in the military, industrial engineer, plumber, recording engineer, computer technician, webdeveloper, systems engineer, web designer, mechanical engineer, animal trainer, firefighter, pilot, graphic designer, tattoo artist, bar owner, mercenary","counselor, academic, teacher, school counselor, educator, psychologist, college professor, child psychologist, scholar, psychiatrist, event planner, english teacher, therapist, public relations manager, wedding planner, sociologist, medical doctor, research scientist, psychotherapist, public relations specialist"
16,RCUEI ,"atheist/agnostic tendencies, unconcerned with public image, lower energy level, does not value tradition, avoidant, does not put the welfare of others above self, not punctual, unproductive, does not believe in human goodness, not easily moved to tears, seldom bothered by the suffering of strangers, insensitive to the needs of others, relaxed, quiet around strangers, tendency to believe only in self, people have trouble reading them but they don't care, late finishing work, acts without planning, withdrawn, rarely too busy, not a perfectionist, uncooperative, not prone to complimenting people, does not believe in life after death, avoids crowds, prefers unpredictable to organized, not passionate about bettering the world's condition, does not second guess self, able to control cravings, calm in crisis, ambivalent to the feelings of others, believes in the importance of art, dislikes small talk, socially uncomfortable, private, not known for generosity, acts without consulting others, hard to get to know, not easily frustrated, interested in intellectual pursuits, not open about feelings, loner, asks many questions, open to change, influenced more by self than others, bored at work","philosopher, scientist, philosophy professor, video game designer, astronomer, aerospace engineer, author, nuclear engineer, astronaut, assassin, anthropologist, research scientist, archeologist, researcher, strategist, computer scientist, software engineer, game designer, software developer, genetics researcher, freelance writer, paleontologist, engineer, software designer, egyptologist, geneticist, biotechnology, physicist, book editor, scholar, political scientist, historian, novelist, biochemist, sound engineer, computer programmer, chemical engineer, screenwriter, audio engineer, comic book artist, pilot, computer technician, museum curator, computer engineer, computer animator, international spy, chemist, bookseller, academic, college professor, bounty hunter, poet, fighter pilot, biomedical engineer, computer consultant, biologist, web designer, bookstore owner, civil engineer, computer repair tech, microbiologist, playwrite, forest ranger, artist, network engineer, political analyst, composer, neurologist, botanist, professional musician, film director, mechanical engineer, linguist, mercenary, theologian, systems engineer, web developer, dictator, history professor, webmaster, digital artist, cartoonist, cinematographer, architect","child care worker, wedding planner, event planner, event coordinator, child care worker, childhood educator, personal assistant, hair stylist, fashion merchandiser, fashion industry, kindergarten teacher, stylist, stay at home parent, office assistant, preschool teacher, health care worker, hospitality worker, guidance counselor, social worker, secretary, interior decorator"
17,SCOAI ,"happy, level emotions, not easily discouraged, optimistic, fearless, self confident, non-hostile, trusting, rarely sad, social, content, positive, knows where life is going, socially skilled, not quiet around strangers, acts comfortably with others, takes on responsibilities, likes public speaking, not prone to worrying, not apprehensive about new encounters, flexible, adapts easily to new situations, not afraid to draw attention to self, likes to lead, not bored while working, likes others, hard to annoy, calm in crisis, does not second guess self, not embarrassed easily, high energy level, easy to understand, thinks before acting, strong sense or purpose, likes crowds, interested in science, not prone to jealousy, comfortable in unfamiliar situations, fearless, not skeptical, true to self in all circumstances, highly motivated to succeed, decisive, easy to get to know, narcissistic, driven by reason, physically fit, passionate about bettering the world's condition, finishes most things they start, not easily confused, willing to explain things twice, thinks they are extraordinary","medical doctor, scientist, biotechnology, academic, research scientist, scholar, college professor, emt/paramedic, strategist, biologist, forensic scientist, ambassador, public health professional, researcher, neurologist, project manager, supervisor, philosopher, healer, biochemist, medical examiner, medical researcher, political scientist, neurosurgeon, mathematician, international relations specialist, public relations specialist, lawyer, surgeon, manager, philosophy professor, psychologist, professional college student, chemist, public relations manager, pediatrician, genetics researcher, microbiologist, research psychologist, chemistry teacher, sports medicine, military intelligence, nurse, ceo, health educator, physiotherapist, politician, forensic pathologist, diplomat, cardiologist, judge","hair dresser, tatoo artist, makeup artist, bar owner, comic book artist, cartoonist, fashion designer, body piercer, record store owner, shop assistant, assassin, truck driver, stay at home parent"
18,SCOAN ,"easy to understand, knows where life is going, not anxious, social, realistic, rarely loses things, is what they appear to be, easy to get to know, does not require lots of time alone to recharge, fearless, not lonely, happy, not self reflective, not doubting, level emotions, peaceful, non-hostile, does not fear failure, content, positive, good at sports, finishes most things they start, likes eye contact, easy to satisfy, accomplishes work on time, self confident, not prone to addiction, narcissistic, likes to lead, socially skilled, assertive, outgoing, trusting, likes crowds, not easily hurt, decisive, does not second guess self, not easily annoyed, religious tendencies, clean, orderly, good at getting people to like them, thinks before acting, usually not bored, worry free, productive, hard working, responsible, punctual, able to stand up for self, very busy, not easily distracted, logical, comfortable around others, not big on solitude, proper, don't get worked up about most things, relaxed, interested in others, generous, planner","event planner, wedding planner, early childhood educator, child care worker, preschool teacher, secretary, hair stylist, event coordinator, receptionist, guidance counselor, home maker, social services worker, school counselor, beautician, office assistant, stay at home parent, social worker, make up artist, fashion industry, hair dresser, kindergarten teacher, school psychologist, administrative assistant, fashion merchandiser, stylist, counselor, public relations specialist, personal assistant, child psychologist, nanny, health care worker, elementary school teacher, cosmetologist, midwife, pediatric nurse, nurse practitioner, customer service employee, interior designer, office worker","philosopher, scientist, video game designer, research scientist, astronaut, biotechnology, philosophy professor, assassin, astronomer, strategist, archeology, pilot, biochemist, computer engineer, engineer, computer scientist, aerospace engineer, environmental scientist, chemical engineer, paleontologist, biologist, computer networking, fighter pilot, nuclear engineer, architect, political scientist, military intelligence, computer programmer, software developer, archeologist, cia agent, sound engineer, computer tech"
19,SLOAN ,"makes plans and sticks to them, easily moved to tears, prefers organized to unpredictable, easy to get to know, clean, orderly, easily frustrated, heart over mind, prefers to finish things ahead of schedule, always on the go, organized, tense, easily hurt, prone to panic, religious tendencies, gregarious, open, punctual, perfectionist, realist, narcissistic, worrying, values rules and regulations, uninterested in science, competitive, interested in others, always prepared, aggressive, fears doing the wrong thing, generous, helpful, hard working, productive, socially skilled, ambivalent about theoretical discussions, strong sense of purpose, likes to lead, apologetic, finishes most things they start, not scientific, dislikes science fiction, spends more time in group activities than solitary activities, not mystical, not manipulative, traditional, emotional, fits in most places, feels best when romantically involved, prefers the familiar to the unfamiliar, motivated, prefers to do things with others","child care worker, event planner, kindergarten teacher, wedding planner, preschool teacher, early childhood educator, personal assistant, pediatric nurse, hospitality worker, nurse, health care worker, secretary, elementary school teacher, receptionist, event coordinator, nanny, hospitality manager, athletic trainer, social services worker, trainer, customer service employee, public health, manager, administrative support, school counselor, customer service representitive, public relations specialist, nurse practioner, social worker, executive assistant, office manager, supervisor, sports medicine, youth minister, office administrator, fundraiser, medical assitant, public relations manager, sports management, administrative assistant, special education teacher, office assistant, personal trainer, teacher, lifeguard, athlete, home maker, pediatrician, office worker, dance teacher, guidance counselor, youth pastor, beautician, fashion merchandiser, physical therapist, stylist",
20,SLOAI,"open, organized, asks lots of questions, outgoing, prone to panic, easily hurt, narcissistic, detail oriented, concerned about others, the first to act, believes children need firm discipline, finishes most things they start, comfortable around others, upset by the misfortunes of strangers, socially skilled, compliments others frequently, interested in people, busy, interested in the problems of others, tense, physically affectionate, overly nice, likes to lead, generous, in touch with feelings, not afraid to draw attention to self, manipulative, prone to jealousy, worrying, easily excited, motivated by a desire for acclaim, prone to addiction, frequently driven to impress others, passionate about causes, swayed by emotions, curious, anxious, passionate about bettering the world's condition, stressed, keeps spaces clean, believes in human goodness, well informed, thoughtful, assertive, fears doing the wrong thing, rushed","counselor, medical doctor, academic, event coordinator, college professor, school counselor, guidance counselor, psychologist, psychoanalyst, clinical psychologist, school psychologist, therapist, professor of english, teacher, research psychologist, psychiatrist, social services worker, philosophy professor, educator, english teacher, sociologist, activist, event planner, consultant, psychoterapist, forensic psychologist, instructor, theologian, journalist, forensic scientist, health educator, political scientist, special education teacher, researcher, freelance writer, administrator, research scientist, author, lawyer, kindergarten teacher, public relations specialist, fundraiser, book editor, high school teacher","video game designer, assassin, fighter pilot, truck driver, electrician, construction worker, automotive technician, mechanic, computer animator, computer repair technician, military employee, bounty hunter, electrical engineer, mechanical engineer, plumber, pilot, comic book artist, digital artist, computer engineer, computer industry"
21,SLUAI ,"easily confused, often late, rarely prepared, passionate about better the world's condition, easily distracted, wild and crazy, longs for a stabilizing relationship, prone to addiction, often rushed, show off, prone to worry, frequently loses things, does not accomplish work on time, acts without thinking, not good at sports, easily hurt, scatter-brained, very curious, spontaneous, not too hard working, aware of how the color and lighting of a room affects their mood, believes in a supernatural source of peace and love, can be talked into doing silly things, unpredictable, asks many questions, interested in others, upset by the misfortunes of strangers, believes in the importance of art, prefers have many different interests to just one, does not often know why they do things, moody, likes to be the center of attention, swayed by emotions, focuses on fantasies more than reality, acts without planning, becomes overwhelmed by events, able to disregard the rules, not good at saving money, eager to sooth hurt feelings, afraid of doing the wrong thing, can become aggressive when they feel hurt","author, philosophy professor, freelance writer, poet, philosopher, activist, journalist, novelist, freelance artist, playwright, theater industry, performer, songwriter, entertainer, artist, performing arts, creative director, actor, psychoanalyst, theater teacher, psychotherapist, comedian, music journalist, theater director, filmmaker, college professor, media industry, music therapist, painter, broadcast journalist, art director, screen writer, radio broadcaster, art curator, movie director, art therapist, musician, casting director, non profit sector, theologian, magazine editor, psychiatrist, research psychologist, photojournalist, archeologist, photographer, reporter, psychologist, cinematographer, photo journalist, english teacher, book editor, publisher, travel writer, film critic, art teacher, singer, child psychologist, film producer, anthropologist, radio dj, music producer, movie producer, therapist, sociologist, editor, environmentalist, illustrator, bookseller, art historian, counselor","business administrator, financial planner, office manager, financial manager, business manager, banker, sports management, administrative support, accountant, account manager, financial analyst, office worker, business consultant, investment banker"
22,SLUAN ,"often late, influenced more by others than self, easily frustrated, frequently driven to impress others, easily moved to tears, does not believe everything can be explained scientifically, fires back when someone hurts them, not analytical, easily distracted, does not always know what they are doing, easy to get to know, easily impressed, easily influenced, rarely prepared, not controlling, prone to jealousy, not bothered by disorder, low self confidence, acts without hesitation, not self reflective, thinks fun is the most important thing in life, worrying, easily hurt, spontaneous, tense, high maintenance, not detail oriented, unpredictable, prone to attachment, not interested in science, not afraid to draw attention to self, anxious, does not know why they do some things, not strict with self, inexplicably happy some of the time, attentive to appearances, underachiever, bases goals on inspiration rather than logic, will do a lot to avoid rejection, swayed by emotions, uses acts of kindness to get closer to people","hair stylist, entertainer, makeup artist, actor, performer, childcare worker, fashion merchandiser, radio dj, fashion designer, beautician, stylist, kindergarten teacher, theater industry, performing arts, fashion editor, school counselor, singer, wedding planner, massage therapist, analyst, costume designer, dancer, news anchor, dance teacher, stay at home parent, child psychologist, guidance counselor, preschool teacher, music industry, arts and media, entertainment industry, waiter/waitress, elementary school teacher, photographer, theater teacher, music journalist, bar owner, model, therapist, event coordinator, nanny, animal trainer, cosmetologist, stage manager, professional photographer, social worker, casting director, record store owner, receptionist, fundraiser, counselor, musician, special education teacher, interior decorator, body piercer, photo journalist, broadcaster, social services worker, music therapist, special education worker, tattoo artist, career in the television industry, home maker, interior designer","research scientist, researcher, strategist, scientist, academic, scholar, computer engineer, computer industry, technology industry, biotechnology, biomedical engineer, astronomer, systems analyst, nuclear engineer, government employee, data analyst, political scientist, mathematician"
23,SCUAN,"spends more time in group activities than solitary activities, not easily hurt, does not like to do things alone, comes alive in night life activities and crowds, trusting, fits in most places, positive, more comfortable when things are imperfect, more artistic than articulate, does not like to go days without speaking to anyone, more abstract than logical, not self absorbed, not materialistic, self expressive, modest, not vain, likes change, not introspective, happiest when helping others, loyal to a fault, wild and crazy, acts without thinking or planning, thoughtful, happy doing mindless work, easy to persuade, socially comfortable, high energy level, rarely prepared, outgoing, self confident, level emotions, not interested in science, easy to get to know, fearless, content, positive, optimistic, not easily hurt, relaxed, usually happy, able to disregard rules, underachiever, likes to tell jokes, not embarrassed easily, adapts easily to new situations, interested in others","comedian, entertainer, radio dj, bartender, actor, movie star, performer, rock star, bar owner, child care worker, career in the entertainment industry, career in the music industry, lifeguard, television industry, singer, career in the performing arts, athlete, race car driver, hair stylist, massage therapist, sports management, makeup artist, early childhood educator, record store owner or employee, music producer, music performer, coach, hair dresser, body piercer, nanny, songwriter, youth pastor, hospitality worker, fundraiser, tv producer, physical therapist, stage manager, event coordinator, dancer, tatto artist, firefighter, animal trainer, beautician, career in the fashion industry, waiter, model, movie director, police officer, flight attendant, fashion merchandiser, broadcaster, casting director, wedding planner, camera operator, photographer, creative director, theater director, public relations manager, pediatric nurse, musician, special education worker, athletic trainer, youth minister, high school teacher, fashion designer, school counselor, music journalist",
